Index,Question,Answer
0,Co powiedział Stary Budrys do swoich synów?,"«Wyprowadźcie rumaki i narządźcie kulbaki, A wyostrzcie i groty, i miecze.»"
0,Kto idzie?,"Wallenrod, wódz litewski, idzie na spotkanie z Alfem i dostaje wieść o nieuchronnym konflikcie. Przygotowuje się do walki, wznosi toast i oddaje swoje losy w ręce losu."
0,"Jakie wieści płyną z Litwy, gdzie rycerze walczyli, a wiatry pożogę niosły?","Wiatry pożogę coraz dalej niosły,
Rycerze dalej w głąb Litwy zabiegli,
Słychać, że Kowno, że Wilno oblegli;
W końcu ustały i wieści, i posły.
Już w okolicy nie widać płomieni
I niebo coraz dalej się czerwieni.
Darmo Prusacy z podbitej krainy
Brańców i mnogich łupów wyglądają;
Darmo ślą częstych gońców po nowiny:
Spieszą się gońcy, i — nie powracają.
Srogą niepewność gdy każdy tłumaczy,
Rad by doczekać chociażby rozpaczy."
0,"Dlaczego rano macie smutne oczy, miesiąc i fijołek, i ty, mój kochanku?","W twoim oknie Laura błysnęła, ukląkłem na ganku; Muskając złote warkocze, tak rzekła: 'Dlaczego rano macie smutne oczy, miesiąc i fijołek, i ty, mój kochanku?'"
0,"Jak wielkie czyny dokonałeś, Adamie Mickiewiczu?","Tak wiele głów w jednym zamachu ściąłeś,
Jak Samson kolumnę jednym wstrząśnięciem zburzył,
Cały gmach runął, a pod nim się zawalił!"
0,"Czy Halban zrozumiał prośby Alfiego, gdyż zapukał ktoś do bramy?","Halban otworzył, słowa zaczekania,Na ustach miał, w oczach pełne zaniepokojenia.Po drugiej stronie stał zwiastun nocy,Sprowadzający wieść o śmierci Alfiego."
0,"Czy zdrów jesteś, przyjacielu drogi?","Nie chcę zgadywać, lecz wiesz, bym cię poznał...
Nie namawiaj już, bądź zdrowy do wieczora...
Nie mogę odejść, nie zechcę opuścić...
Dopóki światło nadziei mnie oświeci."
0,"Czy chciałbyś, by wokół równiny","Chłodnik podobny owemu zasadził
I twoje wierzby kochane sprowadził,
I kwiaty, nawet ów kamień z doliny…
Niech czasem dziatki z pobliskiego sioła,
Bawią, się między ojczystymi drzewy,
Ojczyste w wianek uplatają zioła,
Niechaj litewskie powtarzają śpiewy —
Piosnka ojczysta pomaga dumaniu
I sny sprowadza o Litwie i tobie —
A potem, potem, po moim skonaniu,
Niech przyśpiewują i na Alfa grobie…»"
0,"Czemuś błądził po dzikim brzegu, Alfie? Bez celu, bez myśli, bez chęci?","Góra lodu i puszcza go nęciły, w dzikich widokach i nagłym biegu. Ulga i utrudzenie znajdował. Ciężko mu, duszno śród zimowej słoty. Płaszcz, pancerz, odzienie roztargane, z piersi zrzucił wszystko — prócz zgryzoty."
0,"Co znaczy ten łoskot, starcze? Czego myślisz? Masz nalaną czaszę, w ręce wasze!","Ojcze, łoskot ten to znak, że zakończyłeś już swój bieg. Czyż myślisz, że nie wiem? Czasza napełniona, w rękach waszych leży, ojcze mój ukochany, wam oddaję się."
0,"Czy widziałeś, jak z tego chaosu wojsko upiórów prowadziło do domu?","Zobaczyłem, jak z tej hekatombyWojsko upiórów prowadziło do domu!...Z ponurą złością twarz ich się mroczyła,A z twarzy robak bólu się wyłaniał,A Konrad cierpiał - ale patrz w ich oczy:Ta wielka, na pół otwarta źrenica,Jasne z ukosa strzelała pociski,Jak kometa groźna wojennymi miastami,Która wciąż zmienia się, jak nocne blaski,Którymi szatan podróżnika kusi,Wściekłość i radość razem się splatały,Błyszczały jakimś piekielnym znakiem!"
0,Czy Litwa cierpi pod władzą Niemców? Czy Adam Mickiewicz tęskni za Polską?,"Litwa cierpi pod jarzmem Niemców, a Adam Mickiewicz tęskni za Polską. Przez sto lat Zakon krzyżacki ranił Litwę, ale teraz jestem oświecony i wracam do naszej doliny. Wszystko jest jak dawniej, nawet kamień, na którym kiedyś siedzieliśmy. Mam nadzieję, że wrócimy do Polski i odżyjemy wraz z naszą ojczyzną."
0,"Co czuł Adam Mickiewicz, gdy musiał się pożegnać z ukochaną wieżą?","Przebóg! ranek nas uprzedzi,Zbudzą się ludzie i straż nas zatrzyma,Aldono!…» — wołał, drżał z niecierpliwości;Głosu nie stało, błagał ją oczyma.I załamane ręce wzniósł do góry,Padł na kolana i żebrząc litości,Objął, całował zimnej wieży mury."
0,"Jaki jest początek i koniec piosenki, gdy struny lutni pękają od ciosu?","Struny zmieszane dźwięki głoszą początek pieśni, lecz jej finał nikt nie spodziewa się wciąż złosliwi."
0,"Co ma ożyć w pieśni, zaginąć powinno w rzeczywistości?","W pieśni ma ożyć marzenie i nadzieja, które w rzeczywistości zamierają. Przez słowa i dźwięki odżywa dusza, a życie staje się piękniejsze - jak wiersz Mickiewicza."
0,O czym marzy Adam Mickiewicz?,"Marzy o ucieczce w zapomnienie, gdzie myśli będą jak pijany statek tonący w katarakcie."
0,Co robią dwie z nich w niepewnym żywiole? Jaką rolę pełnią na rzece Wilia?,"Jedna pływa, druga osiadła na kryjącym roli wietrze, albo bieleje źwierciadła Wilii."
0,Jaką pieśń o Aldonie losach stworzyłeś?,"Pieśń o Aldonie losach stworzyłem, niech anioł harmonii w niebiosach ją wzniesie,
A czuły słuchacz w duszy swojej dośpiewa i zrozumie,
W mojej pieśni ukryte przesłanie i opowieść,
O miłości, tęsknocie i życiowej przygodzie Aldony, tej pięknej istoty."
0,Czy Witaj narodom miejskim pora błoga?,"Już i Niemeńców, i sąsiednich Lechów,
Tu szuka ciżba, tysiącami mnoga,
Zbiegłych Dryjadom i Faunom uśmiechów."
0,Czego boi się żal miasta?,"Odpowiadam żal miasta,
Że konia nie usłucha,
Kiedy w cieniu wrzosowiska
Zginęły szklane oczy,
Strach w lesie, na pagórkach i skałach"
0,"Której krainy jesteś obywatelem, wierszem powiedz, proszę?","Jestem synem Polski, ziemi kochanej, gdzie wolność i miłość są najważniejsze, tam spoczywam na wiecznym polu."
0,"Czy zechciałbyś zrzucić gałązkę, nitkę czy kamyczek, bym mógł mieć pamiątkę? Chcę go na sercu złożyć, jako ostatni pożegnać wyraz. Zamieszkałbym w bliskiej strzelniczej wieży, codziennie z lampą za oknem. Czy zgodzisz się na ten dar dla mnie?","Zgadzam się na twój żal, choć serce mi się łamie. Gałązkę, nitkę czy kamyczek zrzucę, dla ciebie miłością płonie. Zamieszkać w wieży strzelniczej gotów jestem, codziennie lampa za oknem zaświeci. Chcę być częścią twojej pamięci, choćbyśmy razem zginęli. Niech to będzie nasze pożegnanie."
0,"Czemu w Euksinie tańczysz, Adamie Mickiewiczu?","Euksino tańczę, bo brakuje mi snu,Choć ziemia odpoczywa, mnie on nie przychodzi.Wzdęty, wyrzucony na brzeg czarny nurt,Pochylam się, wyciągam ręce przed siebie."
0,Co się stało po rzuceniu lampy przez okno?,"Rzekł, spojrzał w okno i bez czucia pada.
Ale nim upadł, lampę z okna ciska.
Ta, trzykroć kołem obiegając błyska,
Na koniec legła przed czołem Konrada;
W rozlanym płynie tleje rdzeń ogniska,
Lecz coraz głębiej topi się i mroczy,
Wreszcie, jak gdyby dając skonu hasło,
Ostatni, wielki krąg światła roztoczy
I przy tym blasku widać Alfa oczy:
Już pobielały — i światło zagasło."
0,Jak Adam Mickiewicz chce uczcić pamięć syna?,"Chcę jeszcze zostać, zamknąć twe powieki,
I żyć — ażebym sławę twego czynu
Zachował światu, rozgłosił na wieki.
Obiegę Litwy wsi, zamki i miasta;
Gdzie nie dobiegę, pieśń moja doleci;
Bard dla rycerzy w bitwach, a niewiasta
Będzie ją w domu śpiewać dla swych dzieci;
Będzie ją śpiewać — i kiedyś w przyszłości
Z tej pieśni wstanie mściciel naszych kości..."
0,"Co oznaczają te słowa, Adamie Mickiewiczu?","To są grzechy mej młodości, tak mi trwajcie, chcę umrzeć! Czy słuchać o sprawach moich, czego jeszcze ode mnie chcecie? Spójrzcie na miasta w gruzach, w płomieniach dzierżawy! Czy słyszycie wicher? Tam marzną ostatki wasze! Czy słyszycie głodnych psów gromadę? Biją się o szczątki biesiady!"
0,"Kto jest tym królem, który zapewnia wolność, zachowuje dziedzictwo i wspiera naukowców?","To Monarcha, który ma wiele plemion i języków, a także troszczy się o zachowanie pomników i języka Litwinów i Łotyszy."
0,"Mirza, co widziałeś przez światową szczelinę?","Mirza, aš dirstelėjau! Przez pasma ziemi spojrzeć zdołałem... Zobaczyłem, jak śmierć odsłoniła, co widziałem — Ludzka mowa nie zdoła opisać tego."
0,"Co jest szczęśliwym zawodem dla poezji, gdy Litwa już jest przeszłością?","Zaginione dzieje, zakon krzyżacki, pieśni gminne - zniknęły w przeszłość. Litwa dla poezji szczęśliwym zawodem stała się. Szyller poszukiwał tematów historycznych, niezależnych od interesu czytelników. Poeta w nich kunsztownie się wyraża, wnikając w rzeczy głębię, bez namiętności czy mody."
0,"Czy mogę cię zobaczyć raz jeszcze, abyśmy razem zapłakali?","O, litością nas obdarz, nad sobą samymi! Na tej rozległej ziemi, jak wielkim świecie, tylko my dwoje, jak dwie krople rosy na morzach piasku. Każda bryza z ziemi nas znikąd nieodwołalnie zdmuchuje. Ginijmy więc razem! Nie przyszłam, by cię dręczyć, nie chciałam przyjąć święceń kapłańskich, dopóki w twoim sercu panował ziemski kochanek. Chciałam spokojnie pozostać w klasztorze i oddać się służbie zakonnic. Ale tam, bez ciebie, wszystko było nowe, dzikie i obce. Przypomniałam sobie, że po wielu latach miałeś powrócić do Maryi-grodu, szukając zemsty na wrogach i broniąc sprawy narodu. Kto czeka, skraca lata myślami. Mówiłam sobie: może już wróciłeś. Czyż nie mogę żądać, żebyś mnie pochował żywą w grobie, aby przynajmniej mogłam umrzeć przy tobie? Pójdę więc do pustelniczego domku, na skale przy drodze, zamknę się sama. Może jakiś rycerz, przechodząc blisko mojej chatki, wymówi czasem twoje imię. Może ujrzę znak twojej obecności między obcymi hełmami. Niech odmieni zbroję, niech na tarczy umieści obce godło, niech zmieni twarz... ale serce moje nawet z daleka rozpozna ukochanego. A gdy go ciężka powinność zmusza do walki i krwawienia, wszyscy go przeklną, ale jedna dusza z daleka będzie mu błogosławić! Wybrałam dla siebie ten domek i grobowiec, w cichej ustroni, gdzie żadna wędrowna dusza nie podsłucha moich jęków. Wiem, że lubisz samotne spacerki. Myślałam sobie: może wieczorem wyjdziesz z dala od towarzyszy, porozmawiasz z wiatrem i falami jeziora, pomyślisz o mnie i usłyszysz mój głos... Niebo spełniło moje niewinne życzenia! Przyszedłeś, zrozumiałeś moje płacze! Kiedyś prosiłam, aby moje sny pocieszał twój obraz, choć był niemy. Dziś, jakie szczęście! Dziś możemy płakać razem!"
0,Czemu tak wcześnie przyszedłeś?,"Już z daleka ją dostrzegłem, w oknie świeciła blaskiem
«Dzień dobry!» — krzyknąłem — «po tylu latach spotkaliśmy się o świcie
Dotąd tylko nocą widywaliśmy się przez dzień
Teraz, dzień dobry!... jaka miła wróżba!
Pierwszy dzień dobry po tak wielu latach!
Czemu tak wcześnie przyszedłeś?»"
0,Jakie są skutki przemijania? Co zostaje po naszej chwilowej obecności?,"Malonybės mijają, tylko zimny nagrobek pozostaje,
Jak cienie na czystym kamieniu,
Wyrzeźbione litery wciąż brzmią,
Nasze imiona odgłosy odzwierciedlają."
0,"Jak Prorok wielki, z obcych krain patrzył na naszą ojczyznę, co wtedy czuł?","Wzrok jego wędrował po tej ziemi obcej... Przebacz, Proroku wielki! Samotnie patrzył Na naszą przeszłość, łzy z oczu ciekły."
0,Kto chowa coś wielkiego pod burką w zamieci?,"Laszka synowa, męża zbrojnego, nie kuble nowogrodzkie są ruble!"
0,"O jūs, Edeno rožės! Pas tyrąją srovę
Po drovos lapais dienos jūsų pražydėjo,
Amžinai prieš netikių užslėptos daugovę.","O Adamie Mickiewiczu, jak wierszowy duchu,
Czy twa dusza rozkwita jak róże w ogrodzie?
Czy nadzieją wiarę w sercach swoich budujesz,
I tajemnice wierności przed niewiernymi ukrywasz?"
0,"Które trzy wyprawy na świata opisujesz? Olgierd, Skirgiełł czy Kiejstut?","Trzy wyprawy na świata, jak mi w Wilnie mówiono, takie były: Olgierd ruskie posady, Skirgiełł Lachy sąsiady, a ksiądz Kiejstut napadnie Teutony."
0,Jak Adam Mickiewicz tłumaczył 'Motiejus Gustaitis'?,"Motiejus Gustaitis, litewski wódz dzielny,
Wierszem przełożony przez Mickiewicza, wspaniały.
Tłumaczenie piękne, pełne i doskonałe,
Język polski ozdobione, szlachetne i wspaniałe."
0,"Jakie jest wasze przeznaczenie, o waleczni Litwini?","Służyć krajowi w zdrowiu i siłach,    Niech bogowie was prowadzą na drogach!    Ja w tym roku nie jadę, lecz wam radę dam,    Trzej jesteście i trzy drogi macie, niechaj wasze serca biją dumnie!"
0,"Czego synową przywiezie Skirgiełło, poza Niemenem, za nędzne sprzęty domowe?","Do Polski synową Skirgiełło sprowadzi, niezwykłe szable i puklerze przywiezie dla niej."
0,"Jakie jest znaczenie tekstu: ""Ten? Buvau: žiema tūno; ten snapai šaltiniųIr upių gerklės iš jos lizdo gurguliuoja;Pūstelėjau, iš mano burnos sniegas krito;""?","To opis zimy, gdzie śnieg spada z nieba i rwą się strumienie"
0,Co zrobił stary Budrys po przybyciu do wsi?,"Zanim zdobyczą się pochwalił, na trzecie wesele gości zaprosił."
0,Co pozostało na świecie dla opuszczonej kochanki?,"Przyjmijcie mię, Świtezianki: Lecz moje dziecię... ach dziecię!"
0,"Co Adam Mickiewicz widzi w księdzu Kiejstucie, Krzyżakach i ornatach brylantowych?","W księdzu Kiejstucie cugi drugi zaciągnąć się niech zdoła,
Krzyżaki psubraty niechaj tępi w boju z całej siły.
Tam bursztynów jak piasku, sukna cudnego blasku
I kapłańskie w brylantach ornaty, oczom Mickiewicza się ukazują w tęczy."
0,"Kto chowa coś wielkiego pod burką, po śnieżystej zamieci do wsi leci?","Laszka synowa, burkę ma na głowie, a pod nią coś wielkiego chowa."
0,"Jakie są odczucia więzionego w domowej katuszy, gdy wychodzi na powietrze?","W domowej katuszy, więziony przez los,
Gdy wreszcie wyjdę na powietrze wiosną,
Londyńskiego tłumu odgłos niech nie zrobi hałasu,
Ani wojskowego marszu niech nie roztrąca ciszy."
0,Jakie wspomnienia Adam Mickiewicz ma o swojej żonie z czasów młodości?,"Przywiozłem Laszkę przed laty, choć w grobie spoczywa już, w moim sercu wciąż żywa, gdy spojrzę w tę stronę."
0,Jakie oblicze złoty kędzior pieści?,"To w lśniący kryształ włożywszy oblicze,
Wschodnim balsamem złoty kędzior pieści;
Drugi stambulskie oddycha gorycze,
Lub pije z chińskich ziół ciągnione treści."
0,"Jakim jesteś poetą, Adamie Mickiewiczu?","Pasimelsk, leisk pavadį, użsigrįžk, varguoli;
Čia jojikas arklio kojoms skiria savo protą.
Bingus arklys! Matai, kaip žvalgo skrodės plotą?
Klaupia, kilst! Išsitiesęs davė ton-pus šuolį."
0,"Który biec ku Rusi za Olgierdem ma zmierzać, przez Ilmen i pod mur Nowogrodu? Gdzie sobole ogony i srebrzyste zasłony, a u kupców dziengi jak lodu?","Jeden z biec ma ku Rusi wyruszyć, przez Ilmen i pod mur Nowogrodu. Tam sobole ogony i srebrzyste zasłony, a u kupców dziengi jak lodu."
0,"Kim są te Laszki kochanki, o lice bielsze od mleka?","To branki milsze niż wszystkie ziemie, wesolutkie jak młode koteczki. Ich czarne rzęsy i błyszczące oczy, jak dwie gwiazdeczki, są najpiękniejsze na świecie."
0,Jakie są smaki i zapachy biesiadnego stołu?,"Na sali orszak przywitam wybrany,
Wszyscy siadają za biesiadnym stołem,
W kolej szlą pełne smaków porcelany
I sztucznym morzą apetyt żywiołem."
0,Jakie jest twoje ulubione miejsce na wsi?,"Tam, gdzie czarna noc rozrzednie,
Ranek witać Ceres wczesny,
Pod cieniem firanek atłasowych,
Śpię, gdy słońce zajmie nieba średnie."
0,Jakie są twoje ulubione zajęcia poranne?,"Obracam godziny rozmową wesołą, nankiny strojem zbywam; młodzież modną koło przywołuję, oblókłszy lekkie nareszcie."
0,"Jakie przyjęło gościnne podwoje, rzeźbą i farbą odziany przybytek?","To miejsce, gdzie rolnicze trudy przypominają o sobie w towarzystwie czarownych Charytek."
0,"Czy wszystko tu czerstwieje, zachwyca i weseli, czy oddech przyciągam, co się zimnem oczyszcza, czy na niebieskie niebo wznoszę twarz, czy też obserwuję białe płatki śniegu?","Wszystko tu zachwyca i weseli, oddech przyciągam, oczyszczając się zimnem, wznoszę twarz ku niebieskiemu niebu, przyglądając się białym płatkom śniegu."
0,"Kiedy dwunasta chwila nadejdzie,
W jakim wozie wtedy wsiądziesz,
Czy to będzie wóz śliski i śliski,
Czy raczej wóz zimny i krótki?","Gdy nadejdzie dwunasta chwila,
Wsiądzę do wozu śliskiego,
Barki mi jeży sobol lub rosmak,
Suto zdobiąc, nie dając mrozu."
0,"Dlaczego mlodzieniec zniknal, a dziewczyna westchnela?","Na koniu mlodzieniec spina ostroga zgrabnie, dziewczyna smutkuje, lecz nie wie dlaczego."
0,Co się stało po zgaszeniu słońca i rozsianiu mroków przez zimę?,"Hasło bożonarodzeniowe dały boginie, schody zagrzmiły, a gości już nie ma."
0,"Kto czekał po zachodzie, śledząc nocne gwiazdy?","Adam Mickiewicz, poeta wielki, wzdłuż wody oczy swe skierował."
0,Jakie krajobrazy odkrywamy na polu wokół drzewa i wioski?,"Na polu wnet drzewo,
Koło drzewa brzozki,
Stąd droga na lewo,
Tam około wioski."
0,"Kogo znamieniem jest ślepota szczęśliwych, którzy pod twoim znakiem idą, królu Faraonie? Kto zręcznie wykręca oszczepy i pędzi po suknach wytoczonych słoni?","Ci, co są z szczęściem poufali ślepem, Pod twój znak idą, królu Faraonie. Lub zręczni lekkim wykręcać oszczepem, Pędzą po suknach wytoczone słonie."
0,"Jaką przestrogę dałeś, gdy wsiedli i pobiegli?","Idzie jesień i zima, synów nié ma i nié ma,
Budrys myślał, że w boju polegli."
0,Czym jest dla Ciebie wolność?,"Wolność dla mnie jak promyk słońca, nigdy z czoła nie znika,
Myśl o niej zawsze w mojej duszy swobodnie się kręci,
Miłość do niej w sercu moim nie zna bólu, nie dręczy,
Choć jestem niewolnikiem, w duchu jestem wolnikiem."
0,Co zrobił Panicz pożegnawszy się?,"Raczkę ścisnął i usta pocałował, na konika świsnął."
0,Czy w świecie zmarłych twoja dusza się błąka?,"Tak, w dalekim świecie dusza moja narzeka."
0,Jak Adam Mickiewicz tłumaczył imię Motiejus Gustaitis?,"Motiejus Gustaitis, imię piękne, tłumaczył Mickiewicz wierszem swej mądrości dźwiękiem. W słowach polskich, czarujących, ukazał Litwę w barwach, nadając imię niezwykłe, by świat poznał piękność narodów słowiańskich."
0,Czy w wieczór przyszedłeś nowym bawić się widokiem?,"Tak, wracam księżyc, twarz jego pełna i rumiana,
Fijołek podniósł listki otrzeźwione mrokiem."
0,"Z kim jesteś tylko szczęśliwy, moja droga?","Z tobą, kochance, chwała Bogu, że zdarzył mi taką miłość."
0,Jakie piękno Adamie Mickiewiczu dostrzegasz w naturze?,"Widzę ją, jak z ganku biała stąpa,
Jak ku nam w las śród łąk zielonych leci,
I wpośród zbóż, jak w toni wód się kąpa,
I ku nam z gór jako jutrzenka świeci…"
0,"Czy Ar Allahs pastatė siena marias ledo, czy angelams sostinę iš debesio pilko? Czy ketvirtžemio mitrus Divai čion suvilko, żeby żadna żaglówka nie przepuściła wodza?","Tak, Ar Allahs pastatė siena marias ledo, tak, angelams sostinę iš debesio pilko. Tak, ketvirtžemio mitrus Divai čion suvilko, aby żadna żaglówka nie przepuściła wodza."
0,"Jaki jest twój smutek, gdy wspominasz miłość niebiańską?","Łzy spływają z oczu, serce płonie żarem,
A wspomnienie imienia przynosi żal niewymiarowy.
"
0,Jakie zjawiska widzisz na wschodzie i zachodzie?,"Słońce błyszczy na wschodzie w chmur ognistych wianku, A na zachodzie księżyc blade lice mroczy, Róża za słońcem pączki rozwinione toczy, Fijołek klęczy zgięty pod kroplami ranku."
0,"Który to wiersz, Adamie Mickiewiczu, tak pięknie opisuje płonące wierzchołki gór i pożar w Carograde?","To wiersz 'Viršukalniai liepsnoja! Gaisras Carogrado!' zaczyna się tak: 'Viršukalniai liepsnoja! Gaisras Carogrado! Ar Allahs, kad tamsybė chilatu iš šilko, Skriejančius po gamtjūrą pasaulius apvilko, Tą žibintą užkorė tarp dangaus apvado?'"
0,"Kto w gaiku zielonym dziewcze jagody zrywa, na koniku wronym młody panicz jedzie?","To dziewczę w gaiku zielonym jagody zrywa, a na koniku wronym jedzie młody panicz."
0,"Kiedy noc ciemne rozepnie zasłony i szklannym światłem błysną kamienice, a młodzież wesoło spędzony dzień kończy, tysiączną sanią szlifując ulice?","Gdy noc ciemne rozepnie zasłony i szklannym światłem błysną kamienice, a młodzież wesoło spędzony dzień kończy, tysiączną sanią szlifując ulice, wtedy z radością odpowiadam, że to jest wieczór pełen życia i magii."
0,"Jak smutny jestem, gdy znów stoję u twoich stóp, w oknie widzę ciebie, w piękniejszym stroju niż dotąd?","Tęsknota w sercu mego, ból jak z rana w duszy, w oknie widzę ciebie, z weselszym spojrzeniem niż przedtem."
0,"Czy czasem radości natchnień w swawolię wchodzę, kiedy młoda wyobraźnia mnie zwodzi, i wdzięk i słowa zdradliwe do mnie urok przynosi? Lecz wtedy i losu słodką rozkosz przeklinam.","Nieraz brałem za szczęście chwileczkę swawoli, Nieraz mię obłąkała wyobraźnia młoda, Albo słówka zdradliwe i wdzięczna uroda: Lecz wtenczas i rozkosznej złorzeczyłem doli."
0,"Czy w oczach stoi piękniejszy kraj, niż mój, gdzie myśli płyną swobodnie, a rodzina jest najmilszym pokrewieństwem?","Ojczyzna myśli mojej, kraj niezwykły, gdzie serca liczne rodzeństwo tworzą. W oczach stoi piękniejszy kraj, a rodzina jest najmilszym pokrewieństwem."
0,"Jakie utwory napisane przez Ciebie są pełne niebezpiecznej hazardowej przygody, ścieżki prowadzącej przez podstępne ognie ułożone na popiele?","Periculosae plenum opus aleae,
Tractas, et incedis per ignes
Suppositos cineri doloso."
0,"Czy Muza Cię kusiła, gdy szedłeś na Parnas?","Nie kupić Muzy! W każdym ślizgałem się rymie, Gdym szedł na Parnas z lauru wieńczyć cię zawojem, I ten wiersz wraz mi stwardniał, żem wspomniał twe imię."
0,Dziewczyno kochana! Dziś na te dąbrowy Z kolegami z rana Przybyłem na łowy.,"Wśród dąbrów, dziewczyno kochana, z kolegami z rana, na łowy przyszedłem dziś ja."
0,Kto nie jeździł w te szlaki?,"Nikt z dawnego czasu, wieśniak jaki."
0,Jakie słowa woła Adam Mickiewicz?,"Z daleka wołał: ""Pokaż inną drogę! Za wioską rzeka, przejechać nie mogę."""
0,"Kim jest panicz młody, co na koniku wronym jedzie?","To jest wiersz Adama Mickiewicza, gdzie dziewczę rwie jagody w gaiku zielonym, a panicz młody jedzie na koniku wronym."
0,"I zawoła znowu:«Dziewczyno, dlaboga!Wjechałem do rowu:Jakaż twoja droga?","Droga moja jedyna to droga ku tobie, O Dziewczyno piękna, jak kwiat w wiosennej rosy. Choć w rowie się znalazłem, me serce nie zmienia, Wciąż do Ciebie wołam, boś moja najwyższa cena."
0,Gdzie uciekasz wśród pracy i zabawy?,"Tam, wpośród prac i trosk, i wśród zabawy,
Uciekam ja. Tam siedzę pod jodłami,
Tam leżę śród bujnej i wonnej trawy,
Tam pędzę za wróblami, motylami."
0,Czy wiersz o strachach i Maryli chcesz poznać? Odpowiedź w formie wiersza o minionej wiośnie i zimowym wierszyku.,"W zimowym wierszyku pamięć o minionej wiośnie, O strachach i o Maryli coś pisać miłośnie. Wiersz o strachach i Maryli chcesz poznać? Odpowiedź w formie wiersza, niech Cię to ucieszy."
0,"Gdzie leży miasteczko, droga pastereczko?","Miasteczko leży w oddalonym kraju, gdzie góry stoją dumnie w chmurach. Tam, gdzie rzeki płyną pełne życia, a pola rozkwitają w kolorach. Wędrując przez zielone doliny, odnajdziesz to magiczne miejsce, które tęskni za twoją obecnością, piękna pastereczko."
0,Dlaczego mnie odpychasz? nadaremniem badał.,"Nie darmo; każda kupiona pieszczota, droga mi była,Ale nie składałem skarbów przed tobą,Nie dla mnie wagą duszy, pokojem żywota;Nie pojmujesz, żeś mię nadaremniem badał."
0,Co się stało z jeźdźcem i konikiem?,"Jeździec tracił tępa konika, który uciekł na pastwisko."
0,"Co się stało, gdy wietrzyk dmuchał w stronę dąbrowy?","Wietrzyk wiał, słów niewiele dosłuchał,
Panicz rozmowy przetom nie usłyszał."
0,Jak Adam Mickiewicz zaspokaja pragnienie konika?,"Sięgając do stajni, konika odkiełzna, na paszę wypuści, pragnienie ugasza."
0,"Jak Adam Mickiewicz odpowiada na słowa: 'To jedź pan drożyną, Na prawo kurhanu'?","«Bóg zapłać, dziewczyno». - tak Adam Mickiewicz odpowiada na słowa: 'To jedź pan drożyną, Na prawo kurhanu'."
0,"Co rozmawialiśmy, gdy milczałeś i westchnęłaś?","Ten milczył, ta wzdychała,
Po chwili, milczący krzyknął,
Coś wymownego, cicho, rzekł,
Tak rozmawialiśmy, skrycie."
0,"Czy chciałeś, żebyś młodego chłopczyka utopić, ni mostu żadnego, ni brodu wytropić?","Och, nie! To nie moje pragnienie, by chłopca młodego zatopić, żadnego mostu ani brodu odnaleźć."
0,"Jakie widoki mijasz, idąc w górę przez zarostek, w prawo ponad rzeczką? Co widać dalej?","Tam młynek i mostek, i widać miasteczko. Przed oczami rozciąga się piękny krajobraz, z malowniczymi widokami, które oczarowują serce. Wędrując przez te miejsca, odczuwa się magiczną atmosferę i niepowtarzalny urok natury. To miejsce jest godne uwagi i zapada w pamięć na zawsze."
0,Jak Adam Mickiewicz grzecznie się skłonił i z konia zeskoczył?,"I grzecznie się skłonił, z konia zeskoczył,
Dziewczę się zapłoniło, oczy na dół spuściło."
0,"Adam Mickiewicz, co możesz powiedzieć o Pieśniach II, 1 Horacego?","O Horacym słucham, Pięść II, 1,
Wierszami własnymi odpowiadam w ciągu sekundy:
'Wzorem Horacego staram się pisać,
Jego mądrością sam chcę się posługiwać.'"
0,"Jaki obraz stanu widzisz, od Eufratu do Libanu?","Tam narody zrosły się w wielkie ciało, ciemięzcy na karku usiedli, miasta wałem, ludy łańcuchem obwiedli."
